[
  {
    "id": "xfer-umeda-nishi",
    "a": "node-M11-osaka-metro",
    "b": "node-Y11-osaka-metro",
    "walking_time_min": 4,
    "paid_area": false,
    "same_name": false,
    "note": "Different names, connected. Signs direct Midosuji Umeda ↔ Yotsubashi Nishi-Umeda via underground mall.",
    "category": "different-name-connected"
  },
  {
    "id": "xfer-umeda-higashi",
    "a": "node-M11-osaka-metro",
    "b": "node-T10-osaka-metro",
    "walking_time_min": 5,
    "paid_area": false,
    "same_name": false,
    "note": "Different names, connected. All three Umedas — Midosuji/Nishi/Higashi — treated as one station for Osaka Metro transfer fare.",
    "category": "different-name-connected"
  },
  {
    "id": "xfer-nishi-umeda-higashi-umeda",
    "a": "node-Y11-osaka-metro",
    "b": "node-T10-osaka-metro",
    "walking_time_min": 7,
    "paid_area": false,
    "same_name": false,
    "note": "Different names, connected. Longest of the three Umeda legs; via underground concourse.",
    "category": "different-name-connected"
  },
  {
    "id": "xfer-esaka-through",
    "a": "node-M06-osaka-metro",
    "b": "node-M06-osaka-metro",
    "walking_time_min": 0,
    "paid_area": true,
    "same_name": true,
    "note": "Fare boundary Osaka Metro ↔ Kita-Osaka Kyuko. Single platform through-running; OSM models as one route. KoK supplement applies for M01–M05.",
    "category": "through-run-boundary"
  },
  {
    "id": "xfer-awaza",
    "a": "node-C07-osaka-metro",
    "b": "node-S03-osaka-metro",
    "walking_time_min": 3,
    "paid_area": false,
    "same_name": true,
    "note": "Chuo ↔ Sennichimae. Same-name connected.",
    "category": "same-name-connected"
  },
  {
    "id": "xfer-hommachi-cm",
    "a": "node-C08-osaka-metro",
    "b": "node-M13-osaka-metro",
    "walking_time_min": 3,
    "paid_area": false,
    "same_name": true,
    "note": "Chuo ↔ Midosuji at Hommachi.",
    "category": "same-name-connected"
  },
  {
    "id": "xfer-hommachi-cy",
    "a": "node-C08-osaka-metro",
    "b": "node-Y09-osaka-metro",
    "walking_time_min": 3,
    "paid_area": false,
    "same_name": true,
    "note": "Chuo ↔ Yotsubashi at Hommachi.",
    "category": "same-name-connected"
  },
  {
    "id": "xfer-hommachi-my",
    "a": "node-M13-osaka-metro",
    "b": "node-Y09-osaka-metro",
    "walking_time_min": 3,
    "paid_area": false,
    "same_name": true,
    "note": "Midosuji ↔ Yotsubashi at Hommachi.",
    "category": "same-name-connected"
  },
  {
    "id": "xfer-sakaisuji-hommachi",
    "a": "node-C09-osaka-metro",
    "b": "node-K05-osaka-metro",
    "walking_time_min": 3,
    "paid_area": false,
    "same_name": true,
    "note": "Chuo ↔ Sakaisuji at Sakaisuji-Hommachi.",
    "category": "same-name-connected"
  },
  {
    "id": "xfer-tanimachi-4",
    "a": "node-C10-osaka-metro",
    "b": "node-T13-osaka-metro",
    "walking_time_min": 3,
    "paid_area": false,
    "same_name": true,
    "note": "Chuo ↔ Tanimachi at Tanimachi 4-chome.",
    "category": "same-name-connected"
  },
  {
    "id": "xfer-morinomiya",
    "a": "node-C11-osaka-metro",
    "b": "node-N10-osaka-metro",
    "walking_time_min": 4,
    "paid_area": false,
    "same_name": true,
    "note": "Chuo ↔ Nagahori-Tsurumi-ryokuchi at Morinomiya.",
    "category": "same-name-connected"
  },
  {
    "id": "xfer-midoribashi",
    "a": "node-C12-osaka-metro",
    "b": "node-I02-osaka-metro",
    "walking_time_min": 4,
    "paid_area": false,
    "same_name": true,
    "note": "Chuo ↔ Imazatosuji at Midoribashi.",
    "category": "same-name-connected"
  },
  {
    "id": "xfer-imazato",
    "a": "node-I01-osaka-metro",
    "b": "node-S10-osaka-metro",
    "walking_time_min": 5,
    "paid_area": false,
    "same_name": true,
    "note": "Imazatosuji ↔ Sennichimae at Imazato.",
    "category": "same-name-connected"
  },
  {
    "id": "xfer-gamo-4",
    "a": "node-I04-osaka-metro",
    "b": "node-N13-osaka-metro",
    "walking_time_min": 3,
    "paid_area": false,
    "same_name": true,
    "note": "Imazatosuji ↔ Nagahori-Tsurumi-ryokuchi at Gamo 4-chome.",
    "category": "same-name-connected"
  },
  {
    "id": "xfer-taishibashi-imaichi",
    "a": "node-I08-osaka-metro",
    "b": "node-T03-osaka-metro",
    "walking_time_min": 3,
    "paid_area": false,
    "same_name": true,
    "note": "Imazatosuji ↔ Tanimachi at Taishibashi-Imaichi.",
    "category": "same-name-connected"
  },
  {
    "id": "xfer-tenjinbashisuji-6",
    "a": "node-K01-osaka-metro",
    "b": "node-T08-osaka-metro",
    "walking_time_min": 3,
    "paid_area": false,
    "same_name": true,
    "note": "Sakaisuji ↔ Tanimachi at Tenjinbashisuji 6-chome.",
    "category": "same-name-connected"
  },
  {
    "id": "xfer-nagahoribashi",
    "a": "node-K06-osaka-metro",
    "b": "node-N06-osaka-metro",
    "walking_time_min": 3,
    "paid_area": false,
    "same_name": true,
    "note": "Sakaisuji ↔ Nagahori-Tsurumi-ryokuchi at Nagahoribashi.",
    "category": "same-name-connected"
  },
  {
    "id": "xfer-nippombashi",
    "a": "node-K07-osaka-metro",
    "b": "node-S07-osaka-metro",
    "walking_time_min": 3,
    "paid_area": false,
    "same_name": true,
    "note": "Sakaisuji ↔ Sennichimae at Nippombashi.",
    "category": "same-name-connected"
  },
  {
    "id": "xfer-dobutsuen-mae",
    "a": "node-K09-osaka-metro",
    "b": "node-M17-osaka-metro",
    "walking_time_min": 4,
    "paid_area": false,
    "same_name": true,
    "note": "Sakaisuji ↔ Midosuji at Dobutsuen-mae.",
    "category": "same-name-connected"
  },
  {
    "id": "xfer-shinsaibashi",
    "a": "node-M14-osaka-metro",
    "b": "node-N05-osaka-metro",
    "walking_time_min": 4,
    "paid_area": false,
    "same_name": true,
    "note": "Midosuji ↔ Nagahori-Tsurumi-ryokuchi at Shinsaibashi.",
    "category": "same-name-connected"
  },
  {
    "id": "xfer-namba-ms",
    "a": "node-M15-osaka-metro",
    "b": "node-S06-osaka-metro",
    "walking_time_min": 4,
    "paid_area": false,
    "same_name": true,
    "note": "Midosuji ↔ Sennichimae at Namba.",
    "category": "same-name-connected"
  },
  {
    "id": "xfer-namba-my",
    "a": "node-M15-osaka-metro",
    "b": "node-Y07-osaka-metro",
    "walking_time_min": 4,
    "paid_area": false,
    "same_name": true,
    "note": "Midosuji ↔ Yotsubashi at Namba.",
    "category": "same-name-connected"
  },
  {
    "id": "xfer-namba-sy",
    "a": "node-S06-osaka-metro",
    "b": "node-Y07-osaka-metro",
    "walking_time_min": 3,
    "paid_area": false,
    "same_name": true,
    "note": "Sennichimae ↔ Yotsubashi at Namba.",
    "category": "same-name-connected"
  },
  {
    "id": "xfer-daikokucho",
    "a": "node-M16-osaka-metro",
    "b": "node-Y06-osaka-metro",
    "walking_time_min": 3,
    "paid_area": false,
    "same_name": true,
    "note": "Midosuji ↔ Yotsubashi at Daikokucho.",
    "category": "same-name-connected"
  },
  {
    "id": "xfer-tennoji",
    "a": "node-M18-osaka-metro",
    "b": "node-T17-osaka-metro",
    "walking_time_min": 5,
    "paid_area": false,
    "same_name": true,
    "note": "Midosuji ↔ Tanimachi at Tennoji.",
    "category": "same-name-connected"
  },
  {
    "id": "xfer-nishi-nagahori",
    "a": "node-N03-osaka-metro",
    "b": "node-S04-osaka-metro",
    "walking_time_min": 3,
    "paid_area": false,
    "same_name": true,
    "note": "Nagahori-Tsurumi-ryokuchi ↔ Sennichimae at Nishi-Nagahori.",
    "category": "same-name-connected"
  },
  {
    "id": "xfer-tanimachi-6",
    "a": "node-N08-osaka-metro",
    "b": "node-T14-osaka-metro",
    "walking_time_min": 3,
    "paid_area": false,
    "same_name": true,
    "note": "Nagahori-Tsurumi-ryokuchi ↔ Tanimachi at Tanimachi 6-chome.",
    "category": "same-name-connected"
  },
  {
    "id": "xfer-tanimachi-9",
    "a": "node-S08-osaka-metro",
    "b": "node-T15-osaka-metro",
    "walking_time_min": 3,
    "paid_area": false,
    "same_name": true,
    "note": "Sennichimae ↔ Tanimachi at Tanimachi 9-chome.",
    "category": "same-name-connected"
  }
]
